{
  "schema_version": "1.0.0",
  "id": "mario-odyssey",
  "title": "Super Mario Odyssey",
  "edition_pinned": "Super Mario Odyssey (Nintendo Switch, October 2017 launch) — Capture and Power Moon kingdom structure as shipped; not post-launch costume DLC focus.",
  "genre_tags": [
    "3d-platformer",
    "collectathon",
    "sandbox-kingdom",
    "capture"
  ],
  "register_mapping": "mechanics-first",
  "moat": "Capture converts enemies and objects into temporary move-sets that open moons the base kit cannot reach.",
  "loop_skeleton": {
    "verbs": [
      "jump",
      "cap-throw",
      "capture",
      "moon-collect",
      "kingdom-exit"
    ],
    "description": "Traverse a kingdom with Mario's base moves, throw Cappy to capture a target, use the capture's move-set to reach a Power Moon, bank moons to fuel the Odyssey to the next kingdom when the exit threshold is met."
  },
  "depth_mechanisms": [
    {
      "name": "capture move-set swap",
      "mechanism": "Throwing Cappy onto a legal target temporarily replaces Mario's actions with that target's kit (swim, fly, roll, possess object). Moons are authored around capture tools as first-class solutions, with many also solvable by advanced base movement. General per-capture duration/release rules are not pinned beyond temporary control.",
      "falsifiable_claim": "If Capture is removed and only Mario's base kit remains, moons that require a capture-specific action cannot be completed by the base kit alone."
    },
    {
      "name": "over-supplied moon threshold",
      "mechanism": "Each kingdom offers more Power Moons than the Odyssey exit cost, so players choose which moons to bank rather than following a single mandatory path.",
      "falsifiable_claim": "If moon count equals the exact exit requirement with no surplus, second-session exploration of optional moons stops because every moon becomes a choke rather than a menu of options."
    },
    {
      "name": "capture-as-exploration bait",
      "mechanism": "Kingdoms seed large capturable objects and creatures that advertise new experiences (dinosaur, vehicle-like objects) so exploration seeks new capture toys, not only coin-shaped collectibles.",
      "falsifiable_claim": "If capturable spectacle targets are removed and only coin and platform moons remain, sessions stop introducing new move-set experiences and reduce to pure collectathon routing."
    }
  ],
  "feel_signature": "A throw attaches Cappy to a target; success is a new body with different jump, attack, or traversal rules, then a moon bank that advances the Odyssey exit meter.",
  "second_session_answer": "Players return to farm surplus moons in known kingdoms, reusing world-local capturable targets and post-game moon types, not a persistent unlocked capture roster or a linear boss gauntlet.",
  "packaging_lessons": [
    "Inference: ship one kingdom with base kit plus a small capture roster before stacking multiplayer or post-game moon variants.",
    "Set exit moon costs below available moon supply so the first clear teaches choice, not completionism."
  ],
  "anti_lessons": [
    "Do not treat Capture as a skin swap — if the captured form does not change legal routes or attacks, it is costume, not depth.",
    "Do not copy moon spam without multi-solution placement; quantity without alternate solves is checklist padding."
  ],
  "system_bom": [
    {
      "system": "play-loop",
      "note": "jump, throw, capture, and moon bank form the core cycle that converts kingdom exploration into Odyssey fuel"
    },
    {
      "system": "progression",
      "note": "Power Moon totals unlock Odyssey travel and later kingdoms so collection is the travel gate"
    },
    {
      "system": "skills",
      "note": "world-local capture targets expand legal move-sets without a traditional skill tree or permanent unlock list"
    },
    {
      "system": "ui",
      "note": "Power Moon collection is the visible travel/progress meter; moons are optional among surplus options rather than a single forced path"
    },
    {
      "system": "save-state",
      "note": "Power Moon totals and kingdom travel progress structure multi-session collection; captures remain world-local temporary tools rather than a permanent unlock roster"
    },
    {
      "system": "win-loss-death",
      "note": "death costs up to ten coins as the main penalty (unlimited lives); the card does not claim separate banked-moon loss on death"
    }
  ],
  "citations": [
    {
      "claim": "Moat and capture move-set swap: Capture temporarily controls enemies, creatures, and objects via Cappy to gain new abilities and reach Power Moons.",
      "source": "https://en.wikipedia.org/wiki/Super_Mario_Odyssey"
    },
    {
      "claim": "Capture is temporary control of enemies, creatures, and objects via Cappy; general duration/release rules beyond temporary capture are not claimed.",
      "source": "https://en.wikipedia.org/wiki/Super_Mario_Odyssey"
    },
    {
      "claim": "Over-supplied moon threshold: Power Moons power the Odyssey; kingdoms contain more moons than the exit requirement.",
      "source": "https://en.wikipedia.org/wiki/Super_Mario_Odyssey"
    },
    {
      "claim": "Progression BOM: Power Moons are required to power the Odyssey and travel between kingdoms.",
      "source": "https://www.ign.com/wikis/super-mario-odyssey/Cap_Kingdom_Power_Moons"
    },
    {
      "claim": "Capture-as-exploration bait: designers describe shifting from pure star search to searching for new captures and experiences.",
      "source": "https://www.gamedeveloper.com/design/what-are-devs-saying-about-the-design-of-i-super-mario-odyssey-i-"
    },
    {
      "claim": "Feel signature: Cappy throw enables Capture, which changes movement and combat options used to reach moons.",
      "source": "https://en.wikipedia.org/wiki/Super_Mario_Odyssey"
    },
    {
      "claim": "Feel signature moon bank advances kingdom exit: collected Power Moons fund Odyssey travel.",
      "source": "https://en.wikipedia.org/wiki/Super_Mario_Odyssey"
    },
    {
      "claim": "Second-session answer: surplus moons and post-story collection remain in kingdoms; captures remain world-local targets rather than a permanent unlock roster.",
      "source": "https://en.wikipedia.org/wiki/Super_Mario_Odyssey"
    },
    {
      "claim": "Skills BOM: Capture expands move-sets per target without a traditional skill tree.",
      "source": "https://en.wikipedia.org/wiki/Super_Mario_Odyssey"
    },
    {
      "claim": "UI BOM (narrowed): Power Moons power the Odyssey and kingdoms offer surplus moons; conditional moon lists/hints/uncollected-moon visibility are not claimed.",
      "source": "https://en.wikipedia.org/wiki/Super_Mario_Odyssey"
    },
    {
      "claim": "Save-state BOM (narrowed): multi-session moon collection and kingdom travel are the documented structure; captures are temporary world-local tools, not a permanent unlock roster. Exact story-flag/checkpoint save semantics are not claimed.",
      "source": "https://en.wikipedia.org/wiki/Super_Mario_Odyssey"
    },
    {
      "claim": "Win-loss-death BOM: unlimited lives; dying costs up to ten coins. Banked-moon retention through death is not claimed from this source.",
      "source": "https://en.wikipedia.org/wiki/Super_Mario_Odyssey"
    },
    {
      "claim": "Play-loop BOM: jump, Capture, and moon collection form the kingdom cycle that feeds Odyssey travel.",
      "source": "https://www.gamedeveloper.com/design/what-are-devs-saying-about-the-design-of-i-super-mario-odyssey-i-"
    },
    {
      "claim": "Packaging lesson 1 (labeled Inference): one kingdom plus Capture roster is the minimal vertical slice before post-game moon variants.",
      "source": "https://en.wikipedia.org/wiki/Super_Mario_Odyssey"
    },
    {
      "claim": "Packaging lesson 2: exit costs sit below available moons so the first clear teaches selection among surplus moons.",
      "source": "https://en.wikipedia.org/wiki/Super_Mario_Odyssey"
    },
    {
      "claim": "Director interview context: Power Moons hidden throughout kingdoms and Capture as a core exploration tool.",
      "source": "https://www.gamedeveloper.com/design/what-are-devs-saying-about-the-design-of-i-super-mario-odyssey-i-"
    },
    {
      "claim": "Anti-lesson Capture-as-costume: Capture is defined by gained abilities and new routes, not appearance alone.",
      "source": "https://en.wikipedia.org/wiki/Super_Mario_Odyssey"
    },
    {
      "claim": "Anti-lesson moon quantity without multi-solution: designer coverage stresses experiences and Capture solves, not checklist count alone.",
      "source": "https://www.gamedeveloper.com/design/what-are-devs-saying-about-the-design-of-i-super-mario-odyssey-i-"
    }
  ],
  "status": "draft"
}
