{
  "schema_version": "1.0.0",
  "id": "celeste",
  "title": "Celeste",
  "edition_pinned": "Celeste (Maddy Makes Games / Extremely OK Games, 25 January 2018 launch with Assist Mode as shipped) — Farewell DLC is optional post-content, not the pin.",
  "genre_tags": [
    "precision-platformer",
    "single-player",
    "assist-accessibility"
  ],
  "register_mapping": "mechanics-first",
  "moat": "One air dash plus climb stamina frames every screen as a limited-resource precision solve, not a health fight.",
  "loop_skeleton": {
    "verbs": [
      "run",
      "jump",
      "dash",
      "climb",
      "retry-screen"
    ],
    "description": "Enter a screen, spend the single air dash and limited climb stamina to chain geometry, die on contact with hazards, respawn at the current screen checkpoint, repeat until the screen exits."
  },
  "depth_mechanisms": [
    {
      "name": "dash budget",
      "mechanism": "Madeline has one air dash that recharges on solid ground and from midair dash crystals. Screens are authored so the dash is the scarce commit that gates routes; diagonal eight-way dash is part of the legal input space.",
      "falsifiable_claim": "If players receive unlimited air dashes by default, deaths-per-screen stop tracking screen geometry difficulty and the dash stops being the scarce commit."
    },
    {
      "name": "screen-scoped infinite retry",
      "mechanism": "Death restarts the current single-screen challenge at the local checkpoint; progress is room-exit, not a lives currency. The mountain map chains hundreds of screens so failure cost is local time, not chapter restarts. Per-death resource restore of dash and climb stamina is not claimed from overview sources.",
      "falsifiable_claim": "If death forces a multi-screen checkpoint rollback, completion rate for mid-game chapters drops because retry cost exceeds learning gain."
    },
    {
      "name": "assist mode opt-in break",
      "mechanism": "Assist Mode lets players change game speed, grant infinite dashes, invincibility, and other toggles without a separate story path. Coverage treats Assist as accessibility options that keep the same story path available.",
      "falsifiable_claim": "If Assist Mode is removed and no equivalent toggles exist, players who need those options never reach the ending on the default ruleset."
    }
  ],
  "feel_signature": "Input commits a dash or climb-stamina slice within one screen; failure is a local screen retry, so the decision is always the next frame sequence, not inventory or loadout.",
  "second_session_answer": "Players return to clear the next chapter screens or collect strawberries they skipped, using the same dash budget on harder geometry — not to spend meta currency.",
  "packaging_lessons": [
    "Inference: ship chapter 1 with dash, climb, and screen-scoped retry before any collectible economy; level-design tooling centers on hundreds of precision stages.",
    "Expose Assist toggles as player-owned breaks of the design, not as a hidden difficulty-tier flag that strips story."
  ],
  "anti_lessons": [
    "Do not bolt an XP or loadout layer onto a dash-budget platformer — it hides which inputs failed.",
    "Do not replace screen-scoped retry with long checkpoint gaps; the depth is high death count at low time cost."
  ],
  "system_bom": [
    {
      "system": "play-loop",
      "note": "run-jump-dash-climb-retry is the only required combat-free loop that advances screen geometry"
    },
    {
      "system": "win-loss-death",
      "note": "death is the primary feedback and is expected to be frequent; failure cost is local screen time, not a long rollback"
    },
    {
      "system": "save-state",
      "note": "chapters chain single-screen challenges with checkpoints; strawberries and B-sides are optional collectible goals on the same verbs"
    },
    {
      "system": "ui",
      "note": "dash-ready hair color must stay readable without menus so the scarce dash commit stays visible mid-air; climb stamina is a limited resource without a claimed ordinary on-screen stamina bar"
    },
    {
      "system": "progression",
      "note": "chapter unlocks and B-sides gate harder geometry using the same verbs without new loadout systems"
    }
  ],
  "citations": [
    {
      "claim": "Edition pin context: Maddy Thorson retrospective on Celeste years after the 2018 launch (Assist Mode details are not claimed from this essay).",
      "source": "https://maddythorson.medium.com/four-years-of-celeste-7dccdcc3f7f4"
    },
    {
      "claim": "Moat and dash budget: dash is central; climb contrasts as slower stamina-limited movement versus dash.",
      "source": "https://en.wikipedia.org/wiki/Celeste_(video_game)"
    },
    {
      "claim": "Dash recharges on ground and from midair crystals; dash is the scarce air commit.",
      "source": "https://web.archive.org/web/2024/https://celestegame.fandom.com/wiki/Madeline"
    },
    {
      "claim": "Screen design tools for 300+ hardcore stages and mountain map arrangement (GDC Level Design Workshop).",
      "source": "https://www.youtube.com/watch?v=4RlpMhBKNr0"
    },
    {
      "claim": "Screen-scoped retry: levels are single-screen challenges with checkpoints; high death counts are expected. Per-death full dash/stamina restore is not claimed.",
      "source": "https://en.wikipedia.org/wiki/Celeste_(video_game)"
    },
    {
      "claim": "Assist Mode: alter speed, infinite dashes, invincibility; optional accessibility settings ship with the game.",
      "source": "https://en.wikipedia.org/wiki/Celeste_(video_game)"
    },
    {
      "claim": "Assist Mode written coverage: optional accessibility settings (speed, infinite dash, invincibility) ship with the game and preserve story access.",
      "source": "https://en.wikipedia.org/wiki/Celeste_(video_game)"
    },
    {
      "claim": "Feel signature: limited dash and climb stamina per screen; death returns the player to the local screen challenge for another attempt.",
      "source": "https://web.archive.org/web/2024/https://celestegame.fandom.com/wiki/Madeline"
    },
    {
      "claim": "Second-session answer: strawberries and chapter progression are optional/collectible goals on the same movement verbs.",
      "source": "https://en.wikipedia.org/wiki/Celeste_(video_game)"
    },
    {
      "claim": "Save-state BOM: strawberries are optional collectibles; chapters contain branching paths and hidden collectibles. Exact screen-exit persistence semantics are not claimed beyond single-screen challenges with checkpoints.",
      "source": "https://en.wikipedia.org/wiki/Celeste_(video_game)"
    },
    {
      "claim": "Save-state loop service: B-sides and chapter structure gate harder geometry using the same verbs; deaths retry local screens.",
      "source": "https://en.wikipedia.org/wiki/Celeste_(video_game)"
    },
    {
      "claim": "Win-loss-death BOM (narrowed): death is frequent and local to screens/checkpoints; no-lives-counter and death-count-tracking claims are not asserted from this overview source.",
      "source": "https://en.wikipedia.org/wiki/Celeste_(video_game)"
    },
    {
      "claim": "UI BOM: Madeline's hair color signals dash readiness during play; an ordinary on-screen stamina bar is not claimed.",
      "source": "https://web.archive.org/web/2024/https://celestegame.fandom.com/wiki/Madeline"
    },
    {
      "claim": "Progression BOM: B-Sides unlock harder remixed chapters using the same movement verbs.",
      "source": "https://en.wikipedia.org/wiki/Celeste_(video_game)"
    },
    {
      "claim": "Play-loop BOM: precision platforming with dash and climb is the core single-player structure.",
      "source": "https://en.wikipedia.org/wiki/Celeste_(video_game)"
    },
    {
      "claim": "Packaging lesson 1 (labeled Inference): dash, climb, and local retry are the chapter-1 vertical slice before collectible economy.",
      "source": "https://www.youtube.com/watch?v=4RlpMhBKNr0"
    },
    {
      "claim": "Packaging lesson 2: Assist toggles are player-owned breaks that keep story access.",
      "source": "https://en.wikipedia.org/wiki/Celeste_(video_game)"
    },
    {
      "claim": "Anti-lesson XP/loadout: the design centers on readable input failure on a fixed kit.",
      "source": "https://web.archive.org/web/2024/https://celestegame.fandom.com/wiki/Madeline"
    },
    {
      "claim": "Anti-lesson long checkpoints: GDC tooling and death-local rooms keep failure cost low.",
      "source": "https://www.youtube.com/watch?v=4RlpMhBKNr0"
    }
  ],
  "status": "draft"
}
